CSHT_QNM_00201,Trạm KTế ĐLộc,"Thôn Đại An, xã Đại Nghĩa, huyện Đại Lộc, Quảng Nam",10,108.098800,15.905300,
CSHT_QNM_00202,Trạm An Điềm,"Tổ 3, thôn An Điềm, Xã Đại Lãnh, Huyện Đại  Lộc",10,107.886280,15.872280,
CSHT_QNM_00203,Trạm Chợ Trạm,"Bưu cục Chợ Trạm, Thôn 9, Xã Tam Hiệp, Huyện Núi Thành",2,108.635100,15.441030,
CSHT_QNM_00204,Trạm Quế Lâm,"Thôn 4, xã Quế Lâm, huyện Nông Sơn, tỉnh Quảng Nam",8,107.988890,15.646410,
CSHT_QNM_00205,Trạm Tiên Lập,"Thôn 3, xã Tiên Lập, huyện Tiên Phước, tỉnh Quảng Nam",3,108.369716,15.433456,
CSHT_QNM_00206,Trạm Đại Minh,"Trạm viễn thông Đại Minh, Thôn Ấp Nam, Xã  Đại Minh, Huyện Đaị Lộc",10,108.066360,15.853980,
CSHT_QNM_00207,Trạm Đại Hưng,"Thôn Mậu Lâm, Xã Đại Hưng, Huyện Đại Lộc",10,107.913020,15.862030,
CSHT_QNM_00208,Trạm Hai Bà Trưng (Cửa Suối),"Phường Tân Phú, Thị Xã Hội An,Tỉnh Quảng Nam",4,108.328830,15.892840,
CSHT_QNM_00209,Trạm La Dê,"Thôn Đắc Rế, xã La Dê, huyện Nam Giang",11,107.453890,15.600890,
CSHT_QNM_00210,Trạm Tam Dân,"Thôn Cây Sanh, xã Tam Dân, huyện Phú Ninh, tỉnh Quảng Nam",1,108.420260,15.524070,
CSHT_QNM_00211,Trạm Quế Cường,"Thôn 2, xã Quế Cường, huyện Quế Sơn, tỉnh Quảng Nam",8,108.308110,15.754800,
CSHT_QNM_00212,Trạm Bình Triều (Chợ Được),"Thôn Chợ  Được, xã Bình Triều, Huyện Thăng Bình, Quảng Nam",6,108.393874,15.757640,
CSHT_QNM_00213,Trạm A Nông,"Thôn A Rớt, xã A Nông, Huyện Tây Giang",11,107.467040,15.953920,
CSHT_QNM_00214,Trạm Bà Bồn,"Xã Phước Mỹ, Huyện Phước Sơn",9,107.744080,15.350320,
CSHT_QNM_00215,Trạm Tam Phú,"Xã Tam Phú, huyện Núi Thành, tỉnh Quảng Nam",1,108.514960,15.581520,
CSHT_QNM_00216,Trạm Tam Thăng,"Xã Tam Thăng, TP Tam Kỳ, tỉnh Quảng Nam",1,108.511730,15.625200,
CSHT_QNM_00217,Trạm Bình Quế,"Tổ 6, Thôn Bình Quang, Xã Bình Quế, Huyện Thăng Bình",6,108.377800,15.634640,
CSHT_QNM_00218,Trạm Tam Thái,"Thôn Khánh Thịnh, xã Tam Thái, huyện Phú Ninh",1,108.452090,15.539770,
CSHT_QNM_00219,Trạm Tam Anh Bắc,"Thôn 4, Xã Tam Anh Bắc, Huyện Núi Thành",2,108.562230,15.514390,
CSHT_QNM_00220,Trạm Bình Minh (CSND),"Xã Bình Minh, huyện Thăng Bình, tỉnh Quảng Nam",6,108.422860,15.773230,
CSHT_QNM_00221,Trạm Cẩm Nam,"BĐVHX Cẩm Nam, Thôn 1B Châu Trung, Phường Cẩm Nam,  Tp. Hội An",4,108.338410,15.873260,
CSHT_QNM_00222,Trạm Cầu Chìm,"BC Cầu Chìm, thị trấn Nam Phước, huyện Duy Xuyên",7,108.257420,15.827670,
CSHT_QNM_00223,Trạm Thuận Yên,"Thôn Đông Yên, Phường Hòa Thuận, Thuận Yến, Tp.Tam Kỳ",1,108.460330,15.564400,
CSHT_QNM_00224,Trạm Nam Giang 2,"Thôn Pà Dấu, Thị Trấn Thạnh Mỹ, huyện Nam Giang",11,107.821590,15.735440,
CSHT_QNM_00225,Trạm Đại Hiệp,"Trạm viễn thông Đại Hiệp, tổ 2, Thôn Tích Phú, Xã Đại Hiệp, Huyện Đại Lộc",10,108.126360,15.918060,
CSHT_QNM_00226,Trạm Núi Thành,"Bưu điện Núi Thành, Khối 3, Thị trấn Núi Thành,  Huyện Núi Thành",2,108.660013,15.429850,
CSHT_QNM_00227,Trạm Quế Phong,"Thôn Thuận Long, xã Quế Phong, huyện Quế Sơn, Quảng Nam.",8,108.178606,15.647144,
CSHT_QNM_00228,Trạm BD Kiểm Lâm,"Bưu điện Kiểm Lâm, Thôn La Tháp Tây, Xã Duy Hoà, Huyện Duy Xuyên",7,108.121730,15.838340,
CSHT_QNM_00229,Trạm Cù Lao Chàm,"BD Cù Lao Chàm, đảo Cù Lao Chàm, Tp Hội An, tỉnh Quảng Nam",4,108.506380,15.958200,
CSHT_QNM_00230,Trạm Tam Phú 4,"Thôn Tân Phú, xã Tam Phú, TP Tam Kỳ, tỉnh Quảng Nam",1,108.501650,15.576280,
CSHT_QNM_00231,Trạm Bình Lãnh,"Thôn 3, Xã Bình Lãnh, Huyện Thăng Bình",6,108.252750,15.640810,
CSHT_QNM_00232,Trạm Phước Hiệp,"Xã Phước Hiệp, huyện Phước Sơn, Quảng Nam",9,107.936228,15.460992,
CSHT_QNM_00233,Trạm Chaval,"Thôn A Pát, xã Cha Val, huyện Nam Giang, tỉnh Quảng Nam",11,107.508690,15.620250,
CSHT_QNM_00234,Trạm UB Phước Xuân,"Xã Phước Xuân,Phước Sơn,QNM",9,107.821780,15.491390,
CSHT_QNM_00235,Trạm Tam Lãnh 2,"Thôn 10, xã Tam Lãnh, huyện Phú Ninh, tỉnh Quảng Nam",1,108.409230,15.415440,
CSHT_QNM_00236,Trạm (Phú Nhuận) Duy Tân,"Thôn Phú Nhuận, Xã Duy Tân, Huyện Duy Xuyên, Quảng nam",7,108.090100,15.814630,
CSHT_QNM_00237,Trạm DakMi 1,"Ngã ba Làng Hồi, Xã Phước Xuân, Huyện Phước Sơn, tỉnh Quảng Nam",9,107.824250,15.457270,
CSHT_QNM_00238,Trạm Phước Kim,"Xã Phước Kim, Huyện Phước Sơn, Quảng Nam",9,107.882660,15.335510,
CSHT_QNM_00239,Trạm CLDC Tam Dân,"Thôn Kỳ Tân, xã Tam Dân, huyện Phú Ninh, tỉnh Quảng Nam",1,108.423669,15.513813,
CSHT_QNM_00240,Trạm Phú Thọ,"Đối diện UBND xã Phú Thọ, Quế Sơn, Quảng Nam",8,108.289007,15.736107,
CSHT_QNM_00241,Trạm PSB Tam Tiến,"Bưu điện văn hóa xã Tân Tiến, thôn Tân Bình Trung, xã Tam Tiến, huyện Núi Thành",2,108.563120,15.560211,
CSHT_QNM_00242,Trạm Trà Giác,"Thôn 6 Cẩm Hà, Huyện Bắc Trà My, Tỉnh Quảng Nam",3,108.177280,15.238910,
CSHT_QNM_00243,Trạm Thôn 1 Quế Lưu,Thôn 1 Quế Luu huyện Hiệp Đức,9,108.106960,15.561430,
CSHT_QNM_00244,Trạm Bàn Thạch (Duy Vinh),"BĐVHX Duy Vinh, Thôn Vĩnh Nam, Xã Duy Vinh,  Huyện Duy Xuyên",7,108.327160,15.833020,
CSHT_QNM_00245,Trạm KCN Điện Nam,"KCN Điện Nam, xã Điện Ngọc, huyện Điện Bàn, Quảng Nam",5,108.255360,15.935520,
CSHT_QNM_00246,Trạm Thăng Phước,"Thôn Phú Toản, xã Thăng Phước, huyện Hiệp Đức, Quảng Nam",9,108.150320,15.568420,
CSHT_QNM_00247,Trạm Quế Phước,"Thôn Đông An, Xã Quế Phước, huyện Nông Sơn, tỉnh Quảng Nam",8,107.993470,15.670340,
CSHT_QNM_00248,Trạm CLDC Hà Tân,"Thôn Hà Tân, xã Đại Lãnh, huyện Đại Lộc, tỉnh Quảng Nam",10,107.914130,15.846150,
CSHT_QNM_00249,Trạm Quế Lộc,"Thôn Lộc Trung, Xã Quế Lộc,  Huyện Nông Sơn",8,108.103610,15.703580,
CSHT_QNM_00250,Trạm Tam Hải,"Xã Tam Hải, huyện Núi Thành, tỉnh Quảng Nam",2,108.668720,15.486120,
CSHT_QNM_00251,Trạm Điện Phong,"Thôn Tân Thành, Xã Điện Phong, Huyện Điện Bàn",5,108.238840,15.849900,
CSHT_QNM_00252,Trạm Đăk Pring,"Khu vực đồn biên phòng Đắk Ring, huyện Nam Giang",11,107.571610,15.573320,
CSHT_QNM_00253,Trạm Khu Dân Cư số 1(An Mỹ),"Bưu cục An Mỹ, 97 Nguyễn Duy Hiệu, P. An Mỹ, Tp. Tam Kỳ",1,108.476640,15.565790,
CSHT_QNM_00254,Trạm Nam Trà My,"Đài viễn thông Nam Trà My, Thị trấn Trà Mai, Huyện Nam Trà My",3,108.122540,15.147640,
CSHT_QNM_00255,Trạm Đại Hòa(Quảng Huế ),"Trạm VT Quảng Huế, tổ 3, thôn Quảng Quế, xã Đại Hoà, Huyện Đại Lộc",10,108.121680,15.853340,
CSHT_QNM_00256,Trạm Hiệp Hòa,"Thôn 3, Xã Hiệp Hòa, Huyện Hiệp Đức, tỉnh Quảng Nam",9,108.035950,15.579150,
CSHT_QNM_00257,Trạm Tiên Lộc,"Thôn 2, Xã Tiên Lộc, Huyện Tiên Phước, tỉnh Quảng Nam",3,108.343960,15.467850,
CSHT_QNM_00258,Trạm Tiên Phong,"Thôn 3, Xã Tiên Phong, Huyện Tiên Phước, tỉnh Quảng Nam",3,108.357190,15.521530,
CSHT_QNM_00259,Trạm Điện Quang,"BĐVHX Điện Quang, Thôn Thành Mỹ, Xã Điện Quang,  Huyện Điện Bàn",5,108.170390,15.840910,
CSHT_QNM_00260,Trạm Tam Hòa,"Xã Tam Hòa, Huyện Núi Thành, tỉnh Quảng Nam",2,108.609920,15.506470,
CSHT_QNM_00261,Trạm Tây Giang,"Đài viễn thông Tây Giang, thôn Agrồng, Thị trấn Tây Giang, Huyện Tây Giang",11,107.491530,15.887330,
CSHT_QNM_00262,Trạm Tam Nghĩa,"Thôn Hòa Mỹ, Xã Tam Nghĩa, Huyện Núi Thành",2,108.686740,15.400650,
CSHT_QNM_00263,Trạm Bình nguyên,"Thôn 1 Thanh Ly, Xã Bình Nguyên, Huyện Thăng Bình",6,108.343880,15.760650,
CSHT_QNM_00264,Trạm Bắc chu lai 2,"KCN Bắc Chu Lai -Huyện Núi Thành, Quảng Nam",2,108.596440,15.444720,
CSHT_QNM_00265,Trạm NGOK REN,Thôn 2 xã Trà Mai huyện Nam Trà My tỉnh Quảng Nam,3,108.119437,15.176943,
CSHT_QNM_00266,Trạm 83 Lưu Quý Kỳ,"83 Lưu Quý Kỳ, phường Minh An, TP Hội An, tỉnh Quảng Nam",4,108.325996,15.874870,
CSHT_QNM_00267,Trạm Đồi 211,"Thôn 3, xã Tiên Mỹ, huyện Tiên Phước, tỉnh Quảng Nam",3,108.306700,15.504500,
CSHT_QNM_00268,Trạm Xuyên Tây (3G),Thôn Xuyên Tây thị trấn Nam Phước,7,108.272840,15.833050,
CSHT_QNM_00269,Trạm UB Thanh Hà,"UBND Phường Thanh Hà,TP Hội An",4,108.308310,15.885360,
CSHT_QNM_00270,Trạm Sông Tranh,"Thôn 4, xã Trà Tân, huyện Bắc Trà My",3,108.165280,15.331670,
CSHT_QNM_00271,Trạm Đồi Tiên Lãnh,"Đồi Tiên Lãnh, xã Tiên Lãnh, huyện Phú Ninh",3,108.172700,15.463180,
CSHT_QNM_00272,Trạm CLDC Trà Ka,"Thôn 2, xã Trà Ka, huyện Bắc Trà My, Tỉnh Quảng Nam.",3,108.279442,15.201940,
CSHT_QNM_00273,Trạm Zà Hung,"Thôn A Sanh 2, Xã Za Hung, Huyện Đông Giang, tỉnh Quảng Nam",11,107.647950,15.887550,
CSHT_QNM_00274,Trạm Duy Xuyên,"Trung tâm viễn thông II, Thị trấn Nam Phước, Huyện Duy Xuyên",7,108.283330,15.840470,
CSHT_QNM_00275,Trạm Nam Hùng Vương,"Bưu cục Nam Hùng Vương, Khối 7, Phường An Sơn, Tp. Tam Kỳ",1,108.499210,15.553400,
CSHT_QNM_00276,Trạm Tam Đàn,"KCN Tam Đàn, thôn Thạnh Hòa 2, xã Tam Đàn, huyện Phú Ninh",1,108.442600,15.588800,
CSHT_QNM_00277,Trạm Vĩnh Bình (3G),"Thôn Vĩnh Bình, Tam Thăng, Tam Kỳ, Quảng Nam",1,108.475330,15.617660,
CSHT_QNM_00278,Trạm Xã Ba (QT Viettel),"Thôn Tà Lau, xã Ba, huyện Đông Giang",11,107.881890,15.967860,
CSHT_QNM_00279,Trạm Hà Lam 2,"Tổ 1, thị trấn Hà Lam, huyện Thăng Bình Tỉnh Quảng Nam",6,108.348260,15.728510,
CSHT_QNM_00280,Trạm Điện Hòa,"BĐVHX Điện Hòa, thôn La Thọ 2, xã Điện Hòa, huyện Điện Bàn, tỉnh Quảng Nam",5,108.200940,15.932250,
CSHT_QNM_00281,Trạm 100 Trần Phú,"100 Trần Phú,Hội An,Quảng Nam",4,108.329030,15.877300,
CSHT_QNM_00282,Trạm CLDC Phước Trà,"Khu vực xã Phước Trà 2, huyện Hiệp Đức",9,108.059480,15.489770,
CSHT_QNM_00283,Trạm Tam Phước,"Thôn 3, xã Tam Phước, huyện Phú Ninh, tỉnh Quảng Nam",1,108.397169,15.568487,
CSHT_QNM_00284,Trạm Tiên Lộc 1 (Bình Đào),"Tổ 14 thôn Vân Tiên, xã Bình Đào, huyện Thăng Bình",6,108.438900,15.734810,
CSHT_QNM_00285,Trạm BĐ Tam Thanh (New),"Khu vực thành phố Tam Kỳ, tỉnh Quảng Nam",1,108.539370,15.606180,
CSHT_QNM_00286,Trạm Hưng Mỹ,"Thôn Hưng Mỹ, xã Bình Triều, Huyện Thăng Bình, QNM",6,108.417510,15.729170,
CSHT_QNM_00287,Trạm Thôn 8 Phước Hiệp,"Xã Phước Kim, Huyện Phước Sơn, Quảng Nam",9,107.986960,15.385050,
CSHT_QNM_00288,Trạm Vùng B (Đại Thắng),"Tổ 6, thôn Phú An, xã Đại Thắng, huỵên Đại Lộc, tỉnh Quảng Nam",10,108.075230,15.827190,
CSHT_QNM_00289,Trạm Điện Phương (UBND Xã),"UBND xã Điện Phương, thôn Kim Trung 1, xã Điện Phương, huyện Điện Bàn, tỉnh Quảng Nam",5,108.279980,15.877710,
CSHT_QNM_00290,Trạm CLDC TAUL,"KV Thôn Taul, Huyện Nam Giang  , Tỉnh Quảng Nam",11,107.569890,15.655310,
CSHT_QNM_00291,Trạm Bàn Than (Tam Hải),"Thôn Bàn Than, Xã Tam Hải , huyện Núi thành, tỉnh Quảng Nam",2,108.679510,15.507280,
CSHT_QNM_00292,Trạm Hội An,"Viễn thông Hội An, 06 Trần Hưng Đạo, Phường Minh An, Tp. Hội An",4,108.331780,15.879980,
CSHT_QNM_00293,Trạm CLDC Trà Bui,Thôn 1 - xã Trà Bui - huyện Bắc Trà My - T. Quảng Nam,3,108.051960,15.349810,
CSHT_QNM_00294,Trạm CLDC Châu Sơn,"Thôn Châu Sơn, xã Quế An, huyện Quế Sơn",8,108.188720,15.637930,
CSHT_QNM_00295,Trạm Đồi Vượn Rạnh,Tổ 3 - Thôn Trung An - xã Quế Trung - h. Nông Sơn - T. Quảng Nam,8,108.061280,15.753020,
CSHT_QNM_00296,Trạm An Dưỡng,"Thôn An Dưỡng, xã Bình An, huyện Thăng Bình",6,108.421656,15.654745,
CSHT_QNM_00297,Trạm Khu 4 Ái Nghĩa (3G),"Khu 4, TT Ái Nghĩa, Đại Lộc, Quảng Nam",10,108.116601,15.897942,
CSHT_QNM_00298,Trạm Trà Giáp,"Xã Trà Giáp, Huyện Bắc Trà My,Quảng Nam",3,108.241870,15.225050,
CSHT_QNM_00299,Trạm Điện Thọ,"BĐVHX Điện Thọ, thôn La Trung, xã Điện Thọ, huyện Điện Bàn, tỉnh Quảng Nam",5,108.184010,15.906770,
CSHT_QNM_00300,Trạm Đức Bố,"Thôn Đức Bố 2, Tam Anh, Núi Thành, QNM",2,108.544650,15.504360,
CSHT_QNM_00301,Trạm Thôn 4 Duy Hòa,"Thôn 4, xã Duy Hòa, huyện Duy Xuyên",7,108.107710,15.816280,
CSHT_QNM_00302,Trạm CLDC Bàn Sơn,"Thôn Bàn Sơn, xã Duy Phú, huyện Duy Xuyên",7,108.081570,15.781030,
CSHT_QNM_00303,Trạm Bến xe Hội An,"Khối 1, Bến xe Hội An, Tp Hội An, Quảng Nam",4,108.321710,15.881610,
CSHT_QNM_00304,Trạm Trung Phước,"Bưu điện Nông Sơn, thôn Trung Phước 1, xã Quế Trung, huyện Nông Sơn",8,108.060403,15.719647,
CSHT_QNM_00305,Trạm Thôn 5 Phú Thọ,"Thôn 5, xã Phú Thọ, huyện Quế Sơn",8,108.305749,15.713072,
CSHT_QNM_00306,Trạm Chợ Vĩnh Huy,"Chợ Vinh Huy, Xã Bình Trị, Thăng Bình, Quảng Nam",6,108.287110,15.641130,
CSHT_QNM_00307,Trạm Điện An (UB xã Điện An),"UBND xã Điện An, thôn Phong Nhi, xã Điện An, huyện Điện Bàn, tỉnh Quảng Nam",5,108.237910,15.903250,
CSHT_QNM_00308,Trạm Trà Kiệu,"Thôn Trà Kiệu, xã Duy Sơn, Huỵên Duy Xuyên, tỉnh Quảng Nam",7,108.231700,15.824780,
CSHT_QNM_00309,Trạm Cao Nhí,"Thôn Cao Nhí, Xã Điện An, Huyện Điện Bàn, tỉnh Quảng Nam",5,108.227700,15.884730,
CSHT_QNM_00310,Trạm Việt An,"Trạm viễn thông Việt An, Thôn Việt An, Xã Bình Lâm, Huyện Hiệp Đức",9,108.220950,15.617670,
CSHT_QNM_00311,Trạm Hiệp Hưng Bình Hải,"Xã Bình Hải, Huyện Thăng Bình, QNM",6,108.464290,15.717880,
CSHT_QNM_00312,Trạm Suối Mơ,"Tổ 4, Thôn An Định, Xã Đại Đồng, Huyện Đại Lộc",10,108.019420,15.877500,
CSHT_QNM_00313,Trạm Trà Nam,"Xã Trà Nam, Nam Trà My, Quảng Nam",3,108.070400,15.038040,
CSHT_QNM_00314,Trạm Điện Tiến 2,"Thôn 2 Thái Sơn, Xã Điện Tiến, Huyện Điện Bàn",5,108.178530,15.939500,
CSHT_QNM_00315,Trạm Tam Mỹ Tây,"Xã Tam Mỹ Tây, huyện Núi Thành, tỉnh Quảng Nam",2,108.614530,15.392100,
CSHT_QNM_00316,Trạm ĐTT Nam Trà My,"Thị trấn Trà Mai, huyện Nam Trà My",3,108.116700,15.147650,
CSHT_QNM_00317,Trạm Tú Bình,"Thôn Tú Bình, xã Tam Vinh, huyện Phú Ninh",1,108.386829,15.536253,
CSHT_QNM_00318,Trạm Duy sơn,"Thôn Phú Nham Đông, Xã Duy Sơn, Huyện Duy Xuyên",7,108.216780,15.807980,
CSHT_QNM_00319,Trạm Tam Lãnh,"Thôn An Lâu 1, xã Tam Lãnh, huyện Phú Ninh, tỉnh Quảng Nam",1,108.408330,15.432300,
CSHT_QNM_00320,Trạm Tiên An,"Thôn 3, xã Tiên An, huyện Tiên Phước, tỉnh Quảng Nam",3,108.319780,15.425390,
CSHT_QNM_00321,Trạm Tiên Châu,"Xã Tiên Châu, Huyện Tiên Phước, tỉnh Quảng Nam",3,108.293750,15.509480,
CSHT_QNM_00322,Trạm Bình Giang 2,Thôn 4 Xã Bình Giang huyện Thăng Bình Tỉnh Quảng Nam,6,108.378040,15.781180,
CSHT_QNM_00323,Trạm 405 Trà Dương,"Đồi 405 Trà Dương,Xã Trà Dương,Bắc Trà My,Quảng Nam",3,108.260120,15.396830,
CSHT_QNM_00324,Trạm CLDC La Dê,"Xã La Dee, huyên Nam Giang, Quảng Nam",11,107.410780,15.573660,
CSHT_QNM_00325,Trạm Bình Định,"Thôn Đồng Dương, xã Bình Định, huyện Thăng Bình Quảng Nam",6,108.306630,15.678260,
CSHT_QNM_00326,Trạm Đại Phong,"Tổ 2, thôn Phú Phước, xã Đại Phong, Huyện Đại Lộc",10,108.043740,15.852600,
CSHT_QNM_00327,Trạm Tiên Cảnh,"Thôn 5 xã Tiên Cảnh, huyện Tiên Phước, tỉnh Quảng Nam",3,108.294940,15.462700,
CSHT_QNM_00328,Trạm Đức Phú,"Thôn Đức Phú, Tam Thanh, Núi Thành, QNM",2,108.554860,15.436340,
CSHT_QNM_00329,Trạm PSB Cù Lao Chàm,"Cù lao Chàm, xã Tân Hiệp, TP Hội An",4,108.500430,15.969690,
CSHT_QNM_00330,Trạm Nhơn Bồi,"Thôn 4 Nhơn Bồi, xã Duy Thành, Huyện Duy Xuyên, tỉnh Quảng Nam.",7,108.349800,15.834030,
CSHT_QNM_00331,Trạm Mỹ Phước - Duy Xuyên,"thôn Mỹ Phước,xã Duy Phước, Huyện Duy Xuyên, tỉnh Quảng Nam",7,108.298870,15.857250,
CSHT_QNM_00332,Trạm Duy Thành,"Thôn An Lạc, xã Duy Thành, Huyện Duy Xuyên, tỉnh Quảng Nam.",7,108.322170,15.815490,
CSHT_QNM_00333,Trạm Outdoor Nguyễn Thái Học,"Nguyễn Thái Học, khối 4, P. An Mỹ, TP Tam Kỳ",1,108.483830,15.565340,
CSHT_QNM_00334,Trạm Trường Xuân 2,"Khối phố 5, Phường Trường Xuân, TP Tam Kỳ",1,108.467650,15.546320,
CSHT_QNM_00335,Trạm Thanh Trà (3G),"Xã thanh trà, TT Núi Thành",2,108.669790,15.417480,
CSHT_QNM_00336,Trạm Thôn 3 Tam Phú (3G),"Thôn Phú Quý, Xã tam Phú, TP Tam Kỳ, Quảng Nam",1,108.533001,15.595700,
CSHT_QNM_00337,Trạm An Xuân (CSN),611 Phan Chu Trinh Tp Tam Kỳ,1,108.498400,15.562400,
CSHT_QNM_00338,Trạm Tam An (Tháp - 3G),"Xã Tam An, Huyện Phú Ninh",1,108.446650,15.603660,
CSHT_QNM_00339,Trạm Tứ Ngân (3G),"Thôn Tứ Ngân, Phường Điện Ngọc, TX Điện Bàn, tỉnh Quảng Nam",5,108.240250,15.954150,
CSHT_QNM_00340,Trạm Cầu Cửa Đại,"Thôn 2, xã Cẩm Thanh, TP Hội An",4,108.371790,15.870930,
CSHT_QNM_00341,Trạm Đinh An - Nam Phước (3G),"Thôn Đình An, thị trấn Nam Phước, huyện Duy Xuyên",7,108.276410,15.852910,
CSHT_QNM_00342,"Trạm Phú Phong, An Phú (3G)","Thôn Phú Phong, Phường An Phú, TP Tam Kỳ, Quảng Nam",1,108.495900,15.584760,
CSHT_QNM_00343,Trạm La Thọ,"Thôn La Thọ 3, xã Điện Hòa Huyện Điện Bàn, tỉnh Quảng Nam.",5,108.200350,15.915170,
CSHT_QNM_00344,Trạm Xuân Ngọc,"Thôn Xuân Ngọc 2, xã Tam Anh Nam, Huyện Núi thành, tỉnh Quảng Nam.",2,108.578510,15.456440,
CSHT_QNM_00345,Trạm Thắng Đông,"Thôn Thắng Đông 2, xã Quế An, Huyện Quế Sơn, tỉnh Quảng Nam.",8,108.205470,15.635950,
CSHT_QNM_00346,Trạm Thôn 5 Tam Sơn,"Thôn 5 Tam Sơn, xã Tam Sơn, Huyện Núi thành, tỉnh Quảng Nam.",2,108.505100,15.436510,
CSHT_QNM_00347,Trạm Cẩm Đồng - Điện Phong,"Thôn Cẩm Đồng, xã Điện Phong, Huyện Điện Bàn, tỉnh Quảng Nam.",5,108.239490,15.876550,
CSHT_QNM_00348,Trạm KCN Bắc Chu Lai 2,"KCN Bắc Chu Lai, Xã Tam Hiệp, Huyện Núi Thành, Tỉnh Quảng Nam",2,108.613550,15.443600,
CSHT_QNM_00349,Trạm KDC6 Tân Thạnh (3G),"Khu dân cư số 6, phường Tân Thạnh, TP Tam Kỳ, Quảng Nam",1,108.480810,15.579410,
CSHT_QNM_00350,Trạm 450 Hùng Vương,450 Hùng Vương,1,108.491010,15.557470,
CSHT_QNM_00351,Trạm Mỏ vàng Phước Đức,"Thôn 5 xã Phước Đức, huyện Phước Sơn, tỉnh Quảng Nam",9,107.725860,15.490710,
CSHT_QNM_00352,Trạm CLDC Thôn 5 Tiên Sơn,"Thôn 5, xã Tiên Sơn, huyện Tiên Phước",3,108.251390,15.589430,
CSHT_QNM_00353,Trạm Trà Kót,"Thôn 2B, xã Trà Kót, huyện Bắc Trà My",3,108.388467,15.359998,
CSHT_QNM_00354,Cell_RRU Biển Rạng,"Thôn Thanh Long, xã Tam Quang, huyện Núi Thành",2,108.695400,15.440350,
CSHT_QNM_00355,Hương Sơn Hòa Hương,"Khối Hương sơn, phường Hòa Hương, TP Tam Kỳ",1,108.512040,15.561360,
CSHT_QNM_00356,Cell_RRU Khối 9 An Mỹ,"Khối 9, phường An Mỹ, TP Tam Kỳ",1,108.469830,15.566970,
CSHT_QNM_00357,Thạch Tân Tam Thăng,"Thôn Thạch Tân, xã Tam Thăng, TP Tam Kỳ",1,108.459482,15.611091,
CSHT_QNM_00358,Cell_RRU Inbuilding Mường Thanh,"351A Đường Hùng Vương, Phường An Xuân, TP Tam Kỳ",1,108.486826,15.561102,
CSHT_QNM_00359,Cell_RRU Tam Hiệp Đại Sơn,"Thôn Tam Hiệp, xã Đại Sơn, huyện Đại Lộc",10,107.852960,15.817330,
CSHT_QNM_00360,CLDC Thành Mỹ 3,"TT Thành Mỹ, huyện Nam Giang",11,107.830633,15.764290,
CSHT_QNM_00361,NVH Phước Thịnh,"Nhà Văn Hóa khối Phước Thịnh, phường Cửa Đại, TP Hội An",4,108.386663,15.882255,
CSHT_QNM_00362,456 Cửa Đại,"456 Cửa Đại, P. Cẩm Châu, TP Hội An",4,108.343094,15.881176,
CSHT_QNM_00363,Cell_RRU Khách sạn Victoria,"Đường Âu Cơ, P. Cửa Đại, TP Hội An",4,108.370100,15.894980,
CSHT_QNM_00364,Thôn Tây Yên Tam Đàn,"Thôn Tây Yên, xã Tam Đàn, huyện Phú Ninh",1,108.447053,15.565789,
CSHT_QNM_00365,Trung Nam Trung Phước,"Xóm 2, thôn Trung Nam, xã Quế Trung, huyện Nông Sơn0",8,108.078300,15.715140,
CSHT_QNM_00366,Tân Phong Quế Lộc,"Thôn Tân Phong, xã Quế Lộc, huyện Quế Sơn",8,108.124018,15.693309,
CSHT_QNM_00367,Thôn Ngọc Bích Tam Ngọc,"Thôn Ngọc Bích, xã Tam Ngọc, TP Tam Kỳ",1,108.481111,15.543889,
CSHT_QNM_00368,Đức Ký Nam Điện Thọ,"Thôn Đức Ký Nam, xã Điện Thọ, huyện Điện Bàn",5,108.175090,15.913844,
CSHT_QNM_00369,Cell_RSU Khe Diên,"Xã Phước Ninh, huyện Nông Sơn",8,107.963404,15.698701,
CSHT_QNM_00370,Cell_RSU Quế Ninh,"Xã Quế Ninh, huyện Nông Sơn",8,108.028343,15.693980,
CSHT_QNM_00371,Small Cell Ngã 4 Lê Lợi Nguyễn Thái Học,"Ngã 4, Nguyễn Thái Học, Lê Lợi, phường Minh An, TP Hội An",4,108.328600,15.876520,
CSHT_QNM_00372,Small Cell Resort Nam Hải,"Hạ My Đông B, P. Điện Dương, TX Điện Bàn",5,108.316100,15.927130,
CSHT_QNM_00373,Small Cell Chùa Cầu,"KV Chùa Cầu, đường Nguyễn Thị Minh Khai, TP Hội An",4,108.326100,15.877130,
CSHT_QNM_00374,Small Cell Nga 3 Bạch Đằng Nguyễn Thái Học,"117-119 Nguyễn Thái Học, P. Minh An, TP Hội An",4,108.327100,15.876550,
CSHT_QNM_00375,Small Cell Chợ Hội An,"13 đường Bạch Đằng, P. Minh An, TP Hội An",4,108.332500,15.876680,
CSHT_QNM_00376,12 Đào Duy Từ,"Số 12 Đào Duy Từ, phường Tân Thạnh, TP Tam Kỳ",1,108.473597,15.573439,
CSHT_QNM_00377,Cell_RRU Thôn Thượng Phước Quế Thuận,"Thôn Thượng Phước, xã Quế Thuận, huyện Quế Sơn",8,108.273616,15.721573,
CSHT_QNM_00378,Trạm Thôn Phú Sơn Xã Ba,"Thôn Phú Sơn, xã Ba, huyện Đông Giang",11,107.944114,15.956972,
CSHT_QNM_00379,Thôn A Dinh Chaval,"Thôn A Dinh, xã ChaVal, huyện Nam Giang",11,107.482170,15.601310,
CSHT_QNM_00380,Thôn Cẩm Tú Quế Thọ,"Thôn Cẩm Tú, xã Quế Thọ, huyện Hiệp Đức",9,108.142500,15.603420,
CSHT_QNM_00381,Khương Mỹ Tam Xuân,"Thôn Khương Mỹ, Tam Xuân 1",2,108.508840,15.545050,
CSHT_QNM_00382,An Lương Tam Anh Bắc,"Thôn An Lương, Xã Tam Anh Bắc",2,108.568540,15.498720,
CSHT_QNM_00383,Thôn 3 Duy Hải,"Thôn 3, xã Duy Hải",7,108.393357,15.841742,
CSHT_QNM_00384,Thôn 1 Trà Nú,"Thôn 1, xã Trà Nú",3,108.328236,15.353137,
CSHT_QNM_00385,Khối 8 An Sơn,"Khối 8, Phường An Sơn, TP Tam Kỳ",1,108.492400,15.551690,
CSHT_QNM_00386,Thôn Tú Sơn Bình Trung,"Tổ 3, thôn Tứ Sơn, xã Bình Trung",6,108.437177,15.676275,
CSHT_QNM_00387,Thôn Việt Sơn Bình Trị,"Tổ 4, thôn Việt Sơn, xã Bình Trị",6,108.279898,15.653443,
CSHT_QNM_00388,Thôn Quý Phước Bình Quý,"Thôn Quý Phước, xã Bình Quý",6,108.344925,15.691290,
CSHT_QNM_00389,Thôn Đông Đức Bình Định,"Thôn Đông Đức, xã Bình Định Nam",6,108.319302,15.652701,
CSHT_QNM_00390,Thôn 1 Bình Dương,"Thôn 1, xã Bình Dương",6,108.361320,15.822010,
CSHT_QNM_00391,Thôn Tú Trà Bình Chánh,Tổ 7 Thôn Tú Trà xã Bình Chánh,6,108.370133,15.677543,
CSHT_QNM_00392,Thôn 6 Tiên Thọ,"Thôn 6, xã Tiên Thọ",3,108.342056,15.478498,
CSHT_QNM_00393,Thôn Long Phú Tam Nghĩa,"Thôn Long Phú, xã Tam Nghĩa",2,108.674945,15.395962,
CSHT_QNM_00394,Thôn Vĩnh Quý Tam Vinh,"Thôn Vĩnh Quý, xã Tam Vinh",1,108.385960,15.564344,
CSHT_QNM_00395,Thôn Thăng Tân Tam Thăng,"Thôn Thăng Tân , xã Tam Thăng",1,108.494282,15.624001,
CSHT_QNM_00396,Thôn Thanh Đông Tam Thanh,"Thôn Thanh Đông, xã Tam Thanh",1,108.528760,15.617896,
CSHT_QNM_00397,Thôn Ngọc Mỹ Tam Phú,"Thôn Ngọc Mỹ, xã Tam Phú",1,108.514970,15.606410,
CSHT_QNM_00398,Thôn Thọ Tân Tam Ngọc,"tổ 5, thôn Thọ Tân, xã Tam Ngọc",1,108.492443,15.541215,
CSHT_QNM_00399,Thôn Lộc Đại Quế Hiệp,"Thôn Lộc Đại, xã Quế Hiệp",8,108.206189,15.701246,
CSHT_QNM_00400,Thôn Cang Đông Quế Châu,"Thôn Cang Đông ,Xã Quế Châu",8,108.238573,15.680150,
CSHT_QNM_00401,Thôn 2A Quế Châu,"Thôn 2A, xã Quế Châu",8,108.270250,15.681600,
CSHT_QNM_00402,Thôn 7 Hương An,Thôn 7 xã Hương An,8,108.331200,15.788610,
CSHT_QNM_00403,Thôn Thành Mỹ Tam Phước,"Thôn Thành Mỹ, xã Tam Phước",1,108.408341,15.590463,
CSHT_QNM_00404,Eo Gió Tam Lộc,"Khu vực đèo Eo Gió, xã Tam Lộc",1,108.338830,15.566490,
CSHT_QNM_00405,Thôn Phú Khuê Tam Xuân 2,"Tổ 4, thôn Phú Khuê, xã Tam Xuân 2",2,108.528409,15.529894,
CSHT_QNM_00406,Thôn Tịch Đông Tam Xuân 1,"Thôn Tịch Đông, Tam Xuân 1",2,108.541200,15.556200,
CSHT_QNM_00407,Thôn 1 Tam Xuân 1,"Thôn 1, xã Tam Xuân 1",2,108.493040,15.519040,
CSHT_QNM_00408,Thôn Phú Mỹ Tam Trà,"Thôn Phú Mỹ, xã Tam Trà, huyện Núi Thành",2,108.524470,15.387299,
CSHT_QNM_00409,Thôn Danh Sơn Tam Sơn,Thôn  Danh Sơn xã Tam Sơn,2,108.437010,15.433240,
CSHT_QNM_00410,Thôn Sâm Linh Tam Quang,"Thôn Sâm Linh, xã Tam Quang",2,108.673590,15.464740,
CSHT_QNM_00411,Thôn Long Bình Tam Nghĩa,"Tổ 9, thôn Long Bình, xã Tam Nghĩa",2,108.670054,15.428142,
CSHT_QNM_00412,Thôn Vân Trai Tam Hiệp,"Thôn Vân Trai, xã Tam Hiệp",2,108.639940,15.429194,
CSHT_QNM_00413,Thôn Thọ Khương Tam Hiệp,"Thôn Thọ Khương, xã Tam Hiệp",2,108.624215,15.432456,
