CSHT_QNM_00414,Thôn Đông Xuân Tam Giang,"Thôn Đông Xuân, xã Tam Giang",2,108.651140,15.470360,
CSHT_QNM_00415,K8 Tà Lu,"Dốc K8, xã Tà Lu",11,107.744973,15.951834,
CSHT_QNM_00416,Khối Phố chợ Vĩnh Điện,"Khu phố chợ Vĩnh Điện, thị trấn Vĩnh Điện",5,108.243540,15.892850,
CSHT_QNM_00417,Thôn Hạ Nông Đông Điện Phước,"Thôn Hạ Nông Đông, xã Điện Phước",5,108.210720,15.899950,
CSHT_QNM_00418,Thôn Cẩm Vân Nam Điện Hồng,"Thôn Cẩm Văn Nam, xã Điện Hồng",5,108.164340,15.896010,
CSHT_QNM_00419,Thôn 2 Điện Hồng,"Thôn 2, xã Điện Hồng",5,108.143500,15.875100,
CSHT_QNM_00420,Thôn Phiếm Ái Đại Nghĩa,"Thôn Phiếm Ái 1, xã Đại Nghĩa",10,108.099060,15.874861,
CSHT_QNM_00421,Thôn Nghĩa Bắc Đại Nghĩa,"tổ 5, thôn Nghĩa Bắc, xã Đại Nghĩa",10,108.099429,15.892324,
CSHT_QNM_00422,Thôn Thượng Phước Đại Hòa,"thôn Thượng Phước, xã Đại Hòa",10,108.130843,15.852196,
CSHT_QNM_00423,Thôn Đông Phú Đại Hiệp,"Thôn Đông Phú, xã Đại Hiệp",10,108.136670,15.926750,
CSHT_QNM_00424,Thôn Ô Gia Nam Đại Cường,"Thôn ô Gia Nam, xã Đại Cường",10,108.085190,15.858220,
CSHT_QNM_00425,Thôn Phú Lộc Đại An,"Tổ 3, thôn Phú Lộc, xã Đại An",10,108.111059,15.866982,
CSHT_QNM_00426,Thôn Xuyên Tây 1 Nam Phước,"Thôn Xuyên Tây 1, TT Nam Phước",7,108.256450,15.836650,
CSHT_QNM_00427,Thôn Trà Đông Duy Vinh,"Thôn Trà Đông, xã Duy Vinh",7,108.338830,15.856470,
CSHT_QNM_00428,Thôn Trung Đông Duy Trung,"Thôn Trung Đông, xã Duy Trung",7,108.249950,15.820070,
CSHT_QNM_00429,Thôn 5 Duy Hải,"Thôn 5, xã Duy Hải",7,108.396530,15.868650,
CSHT_QNM_00430,Thôn 8 Trà Tân,"Thôn 8, xã Trà Tân",3,108.124980,15.314280,
CSHT_QNM_00431,Cell_RRU Khách sạn Hoàng Gia,"39 Đào Duy Từ, Cẩm Phô, Hội An",4,108.319946,15.876726,
CSHT_QNM_00432,Trạm Khâm Đức (Nhà Máy Nước),"Xã Phước Xuân, huyện Phước Sơn",9,107.799775,15.460721,
CSHT_QNM_00433,Tổ Minh Đông Bắc Trà My,"Tổ Minh Đông, TT Bắc Trà My",3,108.234305,15.352280,
CSHT_QNM_00434,Thôn Thạch Hưng Tam Xuân 2,"Thôn Thạch Hưng, xã Tam Xuân 2",2,108.528136,15.510345,
CSHT_QNM_00435,Thôn Mỹ Bình Tam Hiệp,"Thôn Mỹ Bình, xã Tam Hiệp",2,108.616523,15.461812,
CSHT_QNM_00436,Khối phố Nam Đông Phú Thịnh,"Hộ Nguyễn Văn Phước, tổ 1, khối phố Nam Đông, TT Phú Thịnh",1,108.405711,15.537366,
CSHT_QNM_00437,Thôn Chánh Lộc Duy Sơn,"Hộ ông Phạm Đăng Ba, tổ 3, thôn Chánh Lộc, xã Duy Sơn, huyện Duy Xuyên",7,108.191479,15.797467,
CSHT_QNM_00438,Thôn Mậu Hòa Duy Trung,"Hộ bà Lê Thị Thu Ba, thôn Mậu Hòa, xã Duy Trung, huyện Duy Xuyên",7,108.262133,15.782684,
CSHT_QNM_00439,Thôn Ngọc Sơn Tây Bình Phục,"Thôn Ngọc Sơn Tây, xã Bình Phục",6,108.363362,15.763693,
CSHT_QNM_00440,Thôn Bình Xá Bình Quế,"Thôn Bình Xá, xã Bình Quế",6,108.370543,15.622098,
CSHT_QNM_00441,Thôn Quý Thịnh 2 Bình Quý,"Tổ 9, thôn Quý Thịnh 2, xã Bình Quý",6,108.326267,15.728060,
CSHT_QNM_00442,Thôn Hòa Hữu Đại Hồng,"Thôn Hòa Hữu, xã Đại Hồng, huyện Đại Lộc",10,107.922835,15.826145,
CSHT_QNM_00443,Thôn A Hu A Tiêng,"Hộ ông: BHLING AXIM. Đ/c thôn Ahu, Xã A Tiêng, Tây Giang",11,107.490863,15.910701,
CSHT_QNM_00444,Tổ 14 Hà Lam,Tổ 14 thị trấn Hà Lam Thăn Bình,6,108.370098,15.722367,
CSHT_QNM_00445,Cell_RRU Pearl River Hội An,"12-14 Huyền Trân Công Chúa, Cẩm Châu, tp. Hội An, Quảng Nam",4,108.347588,15.874823,
CSHT_QNM_00446,KDC An Hà Quảng Phú,"Lô ND62, Đường Nguyễn Đức Trung, phường An Phú, tp Tam Kỳ",1,108.493562,15.595008,
CSHT_QNM_00447,Khu TDC Trường Xuân,"Khu tái định cư Trường Xuân, P. Trường Xuân, TP Tam Kỳ",1,108.475797,15.556801,
CSHT_QNM_00448,Vinpearl Nam Hội An,"Đường ven biển, xã Bình Dương, huyện Thăng Bình",6,108.415127,15.796976,
CSHT_QNM_00449,Bãi Làng Tân Hiệp,"Thôn Bãi Làng, xã Tân Hiệp, TP Hội An, tỉnh Quảng Nam",4,108.513832,15.939660,
